source_id," first_author"," year"," doi"," data_type"," material_type"," cross_section_types"," n_specimens"," n_included"," n_source"," boundary_conditions"," imperfection_reported"," failure_mode_reported"," study_id_notes"," judgement_calls"
afshan2013,S. Afshan,2013,10.1061/(ASCE)ST.1943-541X.0000580,Experimental,Cold-formed ferritic stainless steel (EN 1.4003 and EN 1.4509),"SHS,RHS",31,<=15**,measured,pin-pin,"Yes, w0 and v0",No,,Some specimens failed by combined local and overall buckling so interactive failures need to be reviewed
behzadi2021,B. Behzadi-Sofiani,2021,10.1016/j.engstruct.2021.113281,Both,"Hot-rolled austenitic, duplex, ferritic (EN 1.4307)",Angle,1151,5,measured,fixed-fixed,yes,yes,1 experimental batch (behzadi2021_A) comprising all 5 physical column tests. They share the exact same hot-rolled 70×70×10 cross-section profile and physical coupon test results,"FEA rows excluded at this stage, Derived Le using k-0.5. This study uses equal-angle sections which introudces asymmetric cross-section nature --> may not be relevant in later stages"
theofanous2009,M. Theofanous,2009,10.1016/j.engstruct.2009.08.004,Both,lean_duplex,"SHS, RHS",20 (excl. FEA),,measured,pin-pin,yes,yes,4 batches cleanly separated by the four tested cross-section sizes (theofanous2009_A through D). theofanous2009_A contained only stub columns and was fully excluded,"Prioritised compressive flat material properties over tensile for extraction. Excluded all 8 stub columns because they failed by pure local buckling. FEA excluded for now, raw w0 was recorded however, a combined loading e was enforced to ensure minimum total effective imperfection was L/1500."
huang2013,Y. Huang,2013,10.1016/j.jcsr.2013.01.001,Experimental,lean_duplex,"SHS, RHS",38,16,derived,pin-pin,yes,yes,6 distinct batches (huang2013_A through F) corresponding to the 6 tested cross-section profiles. All specimens in huang_F compeltely excluded due to failure_mode,"n_source = derived, 22 specimens included due to yielding, interactive mode or local buckling failure, extracted material properties from tensile flat coupons, swapped b and h dimensions so h remains parallel to the buckling axis, Le populated with reported values, converted L/delta to raw w0 values in mm, Authors recorded an additional test setup eccentricity (e), meaning the physical columns experienced a total effective imperfection (e+δ) somewhat larger than the raw natural bow w0​ captured here."
buchanan2018,C. Buchanan,2018,10.1016/j.tws.2018.05.006,Both,"austenitic, duplex, ferritic",CHS,497,34,measured,pin-pin,yes,yes,"6 distinct batches (buchanan2018_A through F) cleanly separated by cross-section size, grade and tube origin","Mapped outer diameter D to b and left h null, prioritised compressive stub column material properties over tensile coupons for primary parameters, excluded all 10 stub columns, all 450 FEA models and 3 very short pin-ended ferritic columns that failed by premature local buckling"
ning2021,K. Ning,2021,10.1016/j.jcsr.2021.106579,Both,duplex,CHS,122,7,measurd,pin-pin,yes,yes,"2 distinct physical material batches (ning2021_A and ning2021_B) corresponding to the 2 tested hot-rolled CHS nominal sizes (114×6 and 219×6), as each shares a unique set of averaged tensile coupon results. All 115 FEA models were excluded ","Assigned buckling_axis as - due to perfectly symmetric CHS profiles. Mapped outer diameter D to b and left h null to trigger downstream circular calculations. Extracted material properties from tensile flat coupons rather than compressive properties, as no compressive tests were performed. Excluded all 115 FEA models to prevent artificial dataset inflation and leakage across train/test splits. Stage 2 Flag: The authors determined the average applied loading eccentricity e, natural bow δ0, and total equivalent initial eccentricity eEq. Recorded δ0 as w0, e as we, and eEq as wtotal; the Stage 2 ML model must use this combined wtotal value."